,tweet_id,timestamp,source,text,expanded_urls,name,dog_class,ratings,retweet_count,favorite_count,image_url,breed_prediction_1,prediction_confidence_1,prediction_Match_1,breed_prediction_2,prediction_confidence_2,prediction_Match_2,breed_prediction_3,prediction_confidence_3,prediction_Match_3
0,892177421306343426,2017-08-01 00:17:27,http://twitter.com/download/iphone,"This is Tilly. She's just checking pup on you. Hopes you're doing ok. If not, she's available for pats, snugs, boops, the whole bit. 13/10 https://t.co/0Xxu71qeIV",https://twitter.com/dog_rates/status/892177421306343426/photo/1,Tilly,,1.3,5599,30871,https://pbs.twimg.com/media/DGGmoV4XsAAUL6n.jpg,Chihuahua,0.323581,True,Pekinese,0.0906465,True,papillon,0.0689569,True
1,891815181378084864,2017-07-31 00:18:03,http://twitter.com/download/iphone,This is Archie. He is a rare Norwegian Pouncing Corgo. Lives in the tall grass. You never know when one may strike. 12/10 https://t.co/wUnZnhtVJB,https://twitter.com/dog_rates/status/891815181378084864/photo/1,Archie,,1.2,3709,23220,https://pbs.twimg.com/media/DGBdLU1WsAANxJ9.jpg,Chihuahua,0.716012,True,malamute,0.078253,True,kelpie,0.0313789,True
2,891327558926688256,2017-07-29 16:00:24,http://twitter.com/download/iphone,"This is Franklin. He would like you to stop calling him ""cute."" He is a very fierce shark and should be respected as such. 12/10 #BarkWeek https://t.co/AtUZn91f7f","https://twitter.com/dog_rates/status/891327558926688256/photo/1,https://twitter.com/dog_rates/status/891327558926688256/photo/1",Franklin,,1.2,8335,37276,https://pbs.twimg.com/media/DF6hr6BUMAAzZgT.jpg,basset,0.555712,True,English_springer,0.22577,True,German_short-haired_pointer,0.175219,True
3,890609185150312448,2017-07-27 16:25:51,http://twitter.com/download/iphone,This is Zoey. She doesn't want to be one of the scary sharks. Just wants to be a snuggly pettable boatpet. 13/10 #BarkWeek https://t.co/9TwLuAGH0b,https://twitter.com/dog_rates/status/890609185150312448/photo/1,Zoey,,1.3,3850,25849,https://pbs.twimg.com/media/DFwUU__XcAEpyXI.jpg,Irish_terrier,0.487574,True,Irish_setter,0.193054,True,Chesapeake_Bay_retriever,0.118184,True
4,890240255349198849,2017-07-26 15:59:51,http://twitter.com/download/iphone,This is Cassie. She is a college pup. Studying international doggo communication and stick theory. 14/10 so elegant much sophisticate https://t.co/t1bfwz5S2A,https://twitter.com/dog_rates/status/890240255349198849/photo/1,Cassie,doggo,1.4,6573,29517,https://pbs.twimg.com/media/DFrEyVuW0AAO3t9.jpg,Pembroke,0.511319,True,Cardigan,0.451038,True,Chihuahua,0.0292482,True
5,890006608113172480,2017-07-26 00:31:25,http://twitter.com/download/iphone,This is Koda. He is a South Australian deckshark. Deceptively deadly. Frighteningly majestic. 13/10 would risk a petting #BarkWeek https://t.co/dVPW0B0Mme,"https://twitter.com/dog_rates/status/890006608113172480/photo/1,https://twitter.com/dog_rates/status/890006608113172480/photo/1",Koda,,1.3,6565,28435,https://pbs.twimg.com/media/DFnwSY4WAAAMliS.jpg,Samoyed,0.957979,True,Pomeranian,0.0138835,True,chow,0.00816748,True
6,889638837579907072,2017-07-25 00:10:02,http://twitter.com/download/iphone,This is Ted. He does his best. Sometimes that's not enough. But it's ok. 12/10 would assist https://t.co/f8dEDcrKSR,"https://twitter.com/dog_rates/status/889638837579907072/photo/1,https://twitter.com/dog_rates/status/889638837579907072/photo/1",Ted,,1.2,4008,25057,https://pbs.twimg.com/media/DFihzFfXsAYGDPR.jpg,French_bulldog,0.99165,True,boxer,0.00212864,True,Staffordshire_bullterrier,0.00149818,True
7,889531135344209921,2017-07-24 17:02:04,http://twitter.com/download/iphone,This is Stuart. He's sporting his favorite fanny pack. Secretly filled with bones only. 13/10 puppared puppo #BarkWeek https://t.co/y70o6h3isq,https://twitter.com/dog_rates/status/889531135344209921/photo/1,Stuart,puppo,1.3,2022,14056,https://pbs.twimg.com/media/DFg_2PVW0AEHN3p.jpg,golden_retriever,0.953442,True,Labrador_retriever,0.0138341,True,redbone,0.00795775,True
8,889278841981685760,2017-07-24 00:19:32,http://twitter.com/download/iphone,This is Oliver. You're witnessing one of his many brutal attacks. Seems to be playing with his victim. 13/10 fr*ckin frightening #BarkWeek https://t.co/WpHvrQedPb,https://twitter.com/dog_rates/status/889278841981685760/video/1,Oliver,,1.3,4779,23346,https://pbs.twimg.com/ext_tw_video_thumb/889278779352338437/pu/img/VlbFB3v8H8VwzVNY.jpg,whippet,0.626152,True,borzoi,0.194742,True,Saluki,0.0273507,True
9,888917238123831296,2017-07-23 00:22:39,http://twitter.com/download/iphone,This is Jim. He found a fren. Taught him how to sit like the good boys. 12/10 for both https://t.co/chxruIOUJN,https://twitter.com/dog_rates/status/888917238123831296/photo/1,Jim,,1.2,4021,26973,https://pbs.twimg.com/media/DFYRgsOUQAARGhO.jpg,golden_retriever,0.714719,True,Tibetan_mastiff,0.120184,True,Labrador_retriever,0.105506,True
10,888804989199671297,2017-07-22 16:56:37,http://twitter.com/download/iphone,This is Zeke. He has a new stick. Very proud of it. Would like you to throw it for him without taking it. 13/10 would do my best https://t.co/HTQ77yNQ5K,"https://twitter.com/dog_rates/status/888804989199671297/photo/1,https://twitter.com/dog_rates/status/888804989199671297/photo/1",Zeke,,1.3,3793,23667,https://pbs.twimg.com/media/DFWra-3VYAA2piG.jpg,golden_retriever,0.46976,True,Labrador_retriever,0.184172,True,English_setter,0.0734817,True
11,888554962724278272,2017-07-22 00:23:06,http://twitter.com/download/iphone,This is Ralphus. He's powering up. Attempting maximum borkdrive. 13/10 inspirational af https://t.co/YnYAFCTTiK,"https://twitter.com/dog_rates/status/888554962724278272/photo/1,https://twitter.com/dog_rates/status/888554962724278272/photo/1,https://twitter.com/dog_rates/status/888554962724278272/photo/1,https://twitter.com/dog_rates/status/888554962724278272/photo/1",Ralphus,,1.3,3105,18268,https://pbs.twimg.com/media/DFTH_O-UQAACu20.jpg,Siberian_husky,0.700377,True,Eskimo_dog,0.166511,True,malamute,0.111411,True
12,888078434458587136,2017-07-20 16:49:33,http://twitter.com/download/iphone,This is Gerald. He was just told he didn't get the job he interviewed for. A h*ckin injustice. 12/10 didn't want the job anyway https://t.co/DK7iDPfuRX,"https://twitter.com/dog_rates/status/888078434458587136/photo/1,https://twitter.com/dog_rates/status/888078434458587136/photo/1",Gerald,,1.2,3111,20191,https://pbs.twimg.com/media/DFMWn56WsAAkA7B.jpg,French_bulldog,0.995026,True,pug,0.000931908,True,bull_mastiff,0.000903211,True
13,887705289381826560,2017-07-19 16:06:48,http://twitter.com/download/iphone,This is Jeffrey. He has a monopoly on the pool noodles. Currently running a 'boop for two' midweek sale. 13/10 h*ckin strategic https://t.co/PhrUk20Q64,https://twitter.com/dog_rates/status/887705289381826560/photo/1,Jeffrey,,1.3,4841,28062,https://pbs.twimg.com/media/DFHDQBbXgAEqY7t.jpg,basset,0.821664,True,redbone,0.0875815,True,Weimaraner,0.026236400000000003,True
14,887473957103951883,2017-07-19 00:47:34,http://twitter.com/download/iphone,This is Canela. She attempted some fancy porch pics. They were unsuccessful. 13/10 someone help her https://t.co/cLyzpcUcMX,"https://twitter.com/dog_rates/status/887473957103951883/photo/1,https://twitter.com/dog_rates/status/887473957103951883/photo/1",Canela,,1.3,16125,63667,https://pbs.twimg.com/media/DFDw2tyUQAAAFke.jpg,Pembroke,0.809197,True,Rhodesian_ridgeback,0.05495,True,beagle,0.0389148,True
15,886736880519319552,2017-07-16 23:58:41,http://twitter.com/download/iphone,"This is Mingus. He's a wonderful father to his smol pup. Confirmed 13/10, but he needs your help

https://t.co/bVi0Yr4Cff https://t.co/ISvKOSkd5b","https://www.gofundme.com/mingusneedsus,https://twitter.com/dog_rates/status/886736880519319552/photo/1,https://twitter.com/dog_rates/status/886736880519319552/photo/1",Mingus,,1.3,2869,11081,https://pbs.twimg.com/media/DE5Se8FXcAAJFx4.jpg,kuvasz,0.309706,True,Great_Pyrenees,0.186136,True,Dandie_Dinmont,0.08634630000000001,True
16,886366144734445568,2017-07-15 23:25:31,http://twitter.com/download/iphone,This is Roscoe. Another pupper fallen victim to spontaneous tongue ejections. Get the BlepiPen immediate. 12/10 deep breaths Roscoe https://t.co/RGE08MIJox,"https://twitter.com/dog_rates/status/886366144734445568/photo/1,https://twitter.com/dog_rates/status/886366144734445568/photo/1",Roscoe,pupper,1.2,2837,19579,https://pbs.twimg.com/media/DE0BTnQUwAApKEH.jpg,French_bulldog,0.999201,True,Chihuahua,0.000361178,True,Boston_bull,7.55616e-05,True
17,885984800019947520,2017-07-14 22:10:11,http://twitter.com/download/iphone,Viewer discretion advised. This is Jimbo. He will rip ur finger right h*ckin off. Other dog clearly an accessory. 12/10 pls pet with caution https://t.co/BuveP0uMF1,https://twitter.com/dog_rates/status/885984800019947520/photo/1,Jimbo,,1.2,6026,30191,https://pbs.twimg.com/media/DEumeWWV0AA-Z61.jpg,Blenheim_spaniel,0.972494,True,Shih-Tzu,0.00663012,True,Bernese_mountain_dog,0.00623915,True
18,885528943205470208,2017-07-13 15:58:47,http://twitter.com/download/iphone,This is Maisey. She fell asleep mid-excavation. Happens to the best of us. 13/10 would pat noggin approvingly https://t.co/tp1kQ8i9JF,https://twitter.com/dog_rates/status/885528943205470208/photo/1,Maisey,,1.3,5728,33313,https://pbs.twimg.com/media/DEoH3yvXgAAzQtS.jpg,pug,0.369275,True,Labrador_retriever,0.265835,True,kuvasz,0.134697,True
19,884925521741709313,2017-07-12 00:01:00,http://twitter.com/download/iphone,"This is Earl. He found a hat. Nervous about what you think of it. 12/10 it's delightful, Earl https://t.co/MYJvdlNRVa",https://twitter.com/dog_rates/status/884925521741709313/photo/1,Earl,,1.2,16176,71350,https://pbs.twimg.com/media/DEfjEaNXkAAtPlj.jpg,Italian_greyhound,0.259916,True,American_Staffordshire_terrier,0.198451,True,Staffordshire_bullterrier,0.127725,True
20,884876753390489601,2017-07-11 20:47:12,http://twitter.com/download/iphone,This is Lola. It's her first time outside. Must test the earth and taste the atmosphere. 13/10 you're doing great Lola https://t.co/74TKAUsLkO,"https://twitter.com/dog_rates/status/884876753390489601/photo/1,https://twitter.com/dog_rates/status/884876753390489601/photo/1,https://twitter.com/dog_rates/status/884876753390489601/photo/1,https://twitter.com/dog_rates/status/884876753390489601/photo/1",Lola,,1.3,4999,25774,https://pbs.twimg.com/media/DEe2tZXXkAAwyX3.jpg,chow,0.822103,True,Norwich_terrier,0.106075,True,Norfolk_terrier,0.0373485,True
21,884562892145688576,2017-07-11 00:00:02,http://twitter.com/download/iphone,This is Kevin. He's just so happy. 13/10 what is your secret Kevin https://t.co/1r4MFCbCX5,https://twitter.com/dog_rates/status/884562892145688576/photo/1,Kevin,,1.3,4214,22534,https://pbs.twimg.com/media/DEaZQkfXUAEC7qB.jpg,pug,0.5464060000000001,True,French_bulldog,0.404291,True,Brabancon_griffon,0.0440019,True
22,884162670584377345,2017-07-09 21:29:42,http://twitter.com/download/iphone,Meet Yogi. He doesn't have any important dog meetings today he just enjoys looking his best at all times. 12/10 for dangerously dapper doggo https://t.co/YSI00BzTBZ,https://twitter.com/dog_rates/status/884162670584377345/photo/1,Yogi,doggo,1.2,2681,18918,https://pbs.twimg.com/media/DEUtQbzW0AUTv_o.jpg,German_shepherd,0.707046,True,malinois,0.199396,True,Norwegian_elkhound,0.0491476,True
23,883838122936631299,2017-07-09 00:00:04,http://twitter.com/download/iphone,This is Noah. He can't believe someone made this mess. Got the vacuum out for you though. Offered to help clean pup. 12/10 super good boy https://t.co/V85xujjDDY,https://twitter.com/dog_rates/status/883838122936631299/photo/1,Noah,,1.2,3073,20244,https://pbs.twimg.com/media/DEQGFgAXUAAEvfi.jpg,Doberman,0.610946,True,miniature_pinscher,0.299603,True,kelpie,0.0630203,True
24,883482846933004288,2017-07-08 00:28:19,http://twitter.com/download/iphone,"This is Bella. She hopes her smile made you smile. If not, she is also offering you her favorite monkey. 13.5/10 https://t.co/qjrljjt948","https://twitter.com/dog_rates/status/883482846933004288/photo/1,https://twitter.com/dog_rates/status/883482846933004288/photo/1",Bella,,1.35,8854,42429,https://pbs.twimg.com/media/DELC9dZXUAADqUk.jpg,golden_retriever,0.943082,True,Labrador_retriever,0.032409,True,kuvasz,0.00550072,True
25,883360690899218434,2017-07-07 16:22:55,http://twitter.com/download/iphone,Meet Grizzwald. He may be the floofiest floofer I ever did see. Lost eyes saving a schoolbus from a volcano erpuption. 13/10 heroic as h*ck https://t.co/rf661IFEYP,https://twitter.com/dog_rates/status/883360690899218434/photo/1,Grizzwald,floofer,1.3,3317,21009,https://pbs.twimg.com/media/DEJT3FeXoAAtwUy.jpg,chow,0.987997,True,Tibetan_mastiff,0.00709872,True,Newfoundland,0.00214033,True
26,882762694511734784,2017-07-06 00:46:41,http://twitter.com/download/iphone,This is Gus. He's quite the cheeky pupper. Already perfected the disinterested wink. 12/10 would let steal my girl https://t.co/D43I96SlVu,https://twitter.com/dog_rates/status/882762694511734784/photo/1,Gus,pupper,1.2,4384,26181,https://pbs.twimg.com/media/DEAz_HHXsAA-p_z.jpg,Labrador_retriever,0.85005,True,Chesapeake_Bay_retriever,0.074257,True,flat-coated_retriever,0.015579399999999997,True
27,882627270321602560,2017-07-05 15:48:34,http://twitter.com/download/iphone,This is Stanley. He has his first swim lesson today. Doggle straps adjusted. Ready to go. 13/10 Phelps is nervous (IG: stanleythe_corgi) https://t.co/Nx52PGwH94,https://twitter.com/dog_rates/status/882627270321602560/photo/1,Stanley,,1.3,5450,25956,https://pbs.twimg.com/media/DD-40X3WAAAJPU5.jpg,Pembroke,0.542982,True,Chihuahua,0.251988,True,Cardigan,0.107699,True
28,882268110199369728,2017-07-04 16:01:23,http://twitter.com/download/iphone,This is Alfy. You're witnessing his first watermelon experience. I think it was a success. 13/10 happy 4th Alfy ðŸ‡ºðŸ‡¸ https://t.co/fYP5RlutfA,"https://twitter.com/dog_rates/status/882268110199369728/photo/1,https://twitter.com/dog_rates/status/882268110199369728/photo/1,https://twitter.com/dog_rates/status/882268110199369728/photo/1",Alfy,,1.3,10386,41519,https://pbs.twimg.com/media/DD5yKdPW0AArzX8.jpg,golden_retriever,0.762211,True,Labrador_retriever,0.0989849,True,cocker_spaniel,0.0171995,True
29,881666595344535552,2017-07-03 00:11:11,http://twitter.com/download/iphone,This is Gary. He couldn't miss this puppertunity for a selfie. Flawless focusing skills. 13/10 would boop intensely https://t.co/7CSWCl8I6s,https://twitter.com/dog_rates/status/881666595344535552/photo/1,Gary,,1.3,9570,46952,https://pbs.twimg.com/media/DDxPFwbWAAEbVVR.jpg,Saluki,0.529012,True,Afghan_hound,0.25000300000000003,True,golden_retriever,0.16073900000000002,True
30,880465832366813184,2017-06-29 16:39:47,http://twitter.com/download/iphone,This is Bella. She had her first beach experience this morning. Complete success. 12/10 would perform a sandy boop https://t.co/4VsFysDmiw,"https://twitter.com/dog_rates/status/880465832366813184/photo/1,https://twitter.com/dog_rates/status/880465832366813184/photo/1,https://twitter.com/dog_rates/status/880465832366813184/photo/1,https://twitter.com/dog_rates/status/880465832366813184/photo/1",Bella,,1.2,5570,26382,https://pbs.twimg.com/media/DDgK-J4XUAIEV9W.jpg,golden_retriever,0.913255,True,Labrador_retriever,0.0263286,True,cocker_spaniel,0.00937082,True
31,879862464715927552,2017-06-28 00:42:13,http://twitter.com/download/iphone,This is Romeo. He would like to do an entrance. Requesting your immediate assistance. 13/10 https://t.co/Qh5aEkRQm9,"https://twitter.com/dog_rates/status/879862464715927552/photo/1,https://twitter.com/dog_rates/status/879862464715927552/photo/1,https://twitter.com/dog_rates/status/879862464715927552/photo/1",Romeo,,1.3,3125,20751,https://pbs.twimg.com/media/DDXmPrbWAAEKMvy.jpg,basset,0.813507,True,beagle,0.146654,True,cocker_spaniel,0.00948502,True
32,879415818425184262,2017-06-26 19:07:24,http://twitter.com/download/iphone,This is Duddles. He did an attempt. 13/10 someone help him (vid by Georgia Felici) https://t.co/UDT7ZkcTgY,https://twitter.com/dog_rates/status/879415818425184262/video/1,Duddles,,1.3,40000,98100,https://pbs.twimg.com/ext_tw_video_thumb/879415784908390401/pu/img/cX7XI1TnUsseGET5.jpg,English_springer,0.383404,True,Boston_bull,0.134967,True,Cardigan,0.110481,True
33,879008229531029506,2017-06-25 16:07:47,http://twitter.com/download/iphone,This is Beau. That is Beau's balloon. He takes it everywhere. 13/10 would protect at all costs https://t.co/YDtpCjIPKN,https://twitter.com/dog_rates/status/879008229531029506/photo/1,Beau,,1.3,2406,17650,https://pbs.twimg.com/media/DDLdUrqXYAMOVzY.jpg,vizsla,0.960513,True,miniature_pinscher,0.00943065,True,American_Staffordshire_terrier,0.0087113,True
34,878776093423087618,2017-06-25 00:45:22,http://twitter.com/download/iphone,This is Snoopy. He's a proud #PrideMonthPuppo. Impeccable handwriting for not having thumbs. 13/10 would love back #PrideMonth https://t.co/lNZwgNO4gS,"https://twitter.com/dog_rates/status/878776093423087618/photo/1,https://twitter.com/dog_rates/status/878776093423087618/photo/1",Snoopy,puppo,1.3,3679,17973,https://pbs.twimg.com/media/DDIKMXzW0AEibje.jpg,Italian_greyhound,0.734684,True,whippet,0.15048699999999998,True,Ibizan_hound,0.0397246,True
35,878281511006478336,2017-06-23 16:00:04,http://twitter.com/download/iphone,"Meet Shadow. In an attempt to reach maximum zooming borkdrive, he tore his ACL. Still 13/10 tho. Help him out below

https://t.co/245xJJElsY https://t.co/lUiQH219v6","https://www.gofundme.com/3yd6y1c,https://twitter.com/dog_rates/status/878281511006478336/photo/1",Shadow,,1.3,1152,7174,https://pbs.twimg.com/media/DDBIX9QVYAAohGa.jpg,basset,0.32042,True,collie,0.215975,True,Appenzeller,0.12850699999999998,True
36,878057613040115712,2017-06-23 01:10:23,http://twitter.com/download/iphone,This is Emmy. She was adopted today. Massive round of pupplause for Emmy and her new family. 14/10 for all involved https://t.co/cwtWnHMVpe,"https://twitter.com/dog_rates/status/878057613040115712/photo/1,https://twitter.com/dog_rates/status/878057613040115712/photo/1",Emmy,,1.4,6115,39072,https://pbs.twimg.com/media/DC98vABUIAA97pz.jpg,French_bulldog,0.839097,True,Boston_bull,0.07879939999999999,True,toy_terrier,0.0152434,True
37,877736472329191424,2017-06-22 03:54:17,http://twitter.com/download/iphone,This is Aja. She was just told she's a good dog. Suspicions confirmed. 13/10 would tell again https://t.co/lsPyyAiF1r,"https://twitter.com/dog_rates/status/877736472329191424/photo/1,https://twitter.com/dog_rates/status/877736472329191424/photo/1",Aja,,1.3,17026,73519,https://pbs.twimg.com/media/DC5YqoQW0AArOLH.jpg,Chesapeake_Bay_retriever,0.8379559999999999,True,Labrador_retriever,0.0620342,True,Weimaraner,0.0405991,True
38,877316821321428993,2017-06-21 00:06:44,http://twitter.com/download/iphone,"Meet Dante. At first he wasn't a fan of his new raincoat, then he saw his reflection. H*ckin handsome. 13/10 for water resistant good boy https://t.co/SHRTIo5pxc","https://twitter.com/dog_rates/status/877316821321428993/photo/1,https://twitter.com/dog_rates/status/877316821321428993/photo/1",Dante,,1.3,4678,25469,https://pbs.twimg.com/media/DCza_vtXkAQXGpC.jpg,Saluki,0.5099670000000001,True,Italian_greyhound,0.0904973,True,golden_retriever,0.0794058,True
39,877201837425926144,2017-06-20 16:29:50,http://twitter.com/download/iphone,This is Nelly. He graduated with his dogtorate today. Wants to know if you're proud of him. 12/10 would give congratulatory boop https://t.co/4g4cfj3P4Y,"https://twitter.com/dog_rates/status/877201837425926144/photo/1,https://twitter.com/dog_rates/status/877201837425926144/photo/1",Nelly,,1.2,5012,25179,https://pbs.twimg.com/media/DCxyahJWsAAddSC.jpg,Pembroke,0.93112,True,Cardigan,0.0686982,True,basenji,8.17379e-05,True
40,876838120628539392,2017-06-19 16:24:33,http://twitter.com/download/iphone,This is Ginger. She's having a ruff Monday. Too many pupper things going on. H*ckin exhausting. 12/10 would snug passionately https://t.co/j211oCDRs6,"https://twitter.com/dog_rates/status/876838120628539392/photo/1,https://twitter.com/dog_rates/status/876838120628539392/photo/1",Ginger,pupper,1.2,3003,19236,https://pbs.twimg.com/media/DCsnnZsVwAEfkyi.jpg,bloodhound,0.575751,True,redbone,0.24097,True,Tibetan_mastiff,0.08893480000000001,True
41,876484053909872640,2017-06-18 16:57:37,http://twitter.com/download/iphone,This is Benedict. He wants to thank you for this delightful urban walk. Hopes you know he loves you. 13/10 super duper good boy https://t.co/26BXueUgbs,https://twitter.com/dog_rates/status/876484053909872640/photo/1,Benedict,,1.3,2130,17459,https://pbs.twimg.com/media/DCnll_dUQAAkBdG.jpg,golden_retriever,0.874566,True,Irish_terrier,0.0373542,True,chow,0.016723599999999998,True
42,876120275196170240,2017-06-17 16:52:05,http://twitter.com/download/iphone,"Meet Venti, a seemingly caffeinated puppoccino. She was just informed the weekend would include walks, pats and scritches. 13/10 much excite https://t.co/ejExJFq3ek",https://twitter.com/dog_rates/status/876120275196170240/photo/1,Venti,,1.3,4199,26014,https://pbs.twimg.com/media/DCiavj_UwAAcXep.jpg,Bernese_mountain_dog,0.534327,True,Saint_Bernard,0.346312,True,Greater_Swiss_Mountain_dog,0.0949327,True
43,875747767867523072,2017-06-16 16:11:53,http://twitter.com/download/iphone,"This is Goose. He's a womanizer. Cheeky as h*ck, but also deep. Tongue slip game on another level. 13/10 will steal your girl https://t.co/V2WlACRJCN",https://twitter.com/dog_rates/status/875747767867523072/photo/1,Goose,,1.3,3848,23361,https://pbs.twimg.com/media/DCdH8YpUQAAiEbL.jpg,Labrador_retriever,0.799551,True,Chesapeake_Bay_retriever,0.179975,True,vizsla,0.0046176,True
44,874680097055178752,2017-06-13 17:29:20,http://twitter.com/download/iphone,Meet Cash. He hath acquired a stick. A very good stick tbh. 12/10 would pat head approvingly https://t.co/lZhtizkURD,https://twitter.com/dog_rates/status/874680097055178752/photo/1,Cash,,1.2,4179,25889,https://pbs.twimg.com/media/DCN85nGUwAAzG_q.jpg,Labrador_retriever,0.836052,True,Staffordshire_bullterrier,0.0470691,True,beagle,0.0360071,True
45,874296783580663808,2017-06-12 16:06:11,http://twitter.com/download/iphone,This is Jed. He may be the fanciest pupper in the game right now. Knows it too. 13/10 would sign modeling contract https://t.co/0YplNnSMEm,https://twitter.com/dog_rates/status/874296783580663808/photo/1,Jed,pupper,1.3,3716,24246,https://pbs.twimg.com/media/DCIgSR0XgAANEOY.jpg,cocker_spaniel,0.437216,True,miniature_poodle,0.277191,True,toy_poodle,0.157402,True
46,874012996292530176,2017-06-11 21:18:31,http://twitter.com/download/iphone,"This is Sebastian. He can't see all the colors of the rainbow, but he can see that this flag makes his human happy. 13/10 #PrideMonth puppo https://t.co/XBE0evJZ6V","https://twitter.com/dog_rates/status/874012996292530176/photo/1,https://twitter.com/dog_rates/status/874012996292530176/photo/1",Sebastian,puppo,1.3,9234,31866,https://pbs.twimg.com/media/DCEeLxjXsAAvNSM.jpg,Cardigan,0.806674,True,Pembroke,0.116622,True,kelpie,0.0491819,True
47,873213775632977920,2017-06-09 16:22:42,http://twitter.com/download/iphone,"This is Sierra. She's one precious pupper. Absolute 12/10. Been in and out of ICU her whole life. Help Sierra below

https://t.co/Xp01EU3qyD https://t.co/V5lkvrGLdQ","https://www.gofundme.com/help-my-baby-sierra-get-better,https://twitter.com/dog_rates/status/873213775632977920/photo/1,https://twitter.com/dog_rates/status/873213775632977920/photo/1",Sierra,pupper,1.2,1431,6671,https://pbs.twimg.com/media/DB5HTBGXUAE0TiK.jpg,vizsla,0.6197819999999999,True,bloodhound,0.338069,True,Chesapeake_Bay_retriever,0.0126763,True
48,872620804844003328,2017-06-08 01:06:27,http://twitter.com/download/iphone,This is Monkey. She's supporting owners everywhere with her fancy #PrideMonth bandana. 13/10 love is love is love... https://t.co/lUcpnZDPz9,https://twitter.com/dog_rates/status/872620804844003328/photo/1,Monkey,,1.3,3300,19336,https://pbs.twimg.com/media/DBwr_hzXkAEnZBW.jpg,cocker_spaniel,0.513191,True,Sussex_spaniel,0.159088,True,standard_poodle,0.149509,True
49,871879754684805121,2017-06-06 00:01:46,http://twitter.com/download/iphone,Say hello to Lassie. She's celebrating #PrideMonth by being a splendid mix of astute and adorable. Proudly supupporting her owner. 13/10 https://t.co/uK6PNyeh9w,"https://twitter.com/dog_rates/status/871879754684805121/photo/1,https://twitter.com/dog_rates/status/871879754684805121/photo/1",Lassie,,1.3,9931,35062,https://pbs.twimg.com/media/DBmKAmBXUAE-pQ-.jpg,Shetland_sheepdog,0.969171,True,collie,0.0182607,True,Pomeranian,0.00851534,True
50,871762521631449091,2017-06-05 16:15:56,http://twitter.com/download/iphone,This is Rover. As part of pupper protocol he had to at least attempt to eat the plant. Confirmed not tasty. Needs peanut butter. 12/10 https://t.co/AiVljI6QCg,"https://twitter.com/dog_rates/status/871762521631449091/photo/1,https://twitter.com/dog_rates/status/871762521631449091/photo/1,https://twitter.com/dog_rates/status/871762521631449091/photo/1",Rover,pupper,1.2,3165,18875,https://pbs.twimg.com/media/DBkfY58XcAEdzZy.jpg,Labrador_retriever,0.921393,True,golden_retriever,0.064608,True,bloodhound,0.00338337,True
